<!DOCTYPE module SYSTEM "module.dtd">

<!--
     Airspeed ADC module
     @configure ADC_AIRSPEED on which ADC the sensor is connected
     @define AIRSPEED_SCALE/AIRSPEED_QUADRATIC_SCALE scale factor, quadratic is used if defined
     @define AIRSPEED_BIAS offset on ADC
     -->

<module name="airspeed_adc" dir="sensors">

  <header>
    <file name="airspeed_adc.h"/>
  </header>
  <init fun="airspeed_adc_init()"/>
  <periodic fun="airspeed_adc_update()" freq="10."/>

  <makefile>
    <file name="airspeed_adc.c"/>
  </makefile>
  <makefile target="ap">
    <define name="ADC_CHANNEL_AIRSPEED" value="$(ADC_AIRSPEED)"/>
    <define name="USE_$(ADC_AIRSPEED)"/>
  </makefile>

</module>

