<!DOCTYPE module SYSTEM "module.dtd">

<module name="cam_roll" dir="cam_control">
  <header>
    <file name="cam.h"/>
  </header>
  <init fun="cam_init()"/>
  <periodic fun="cam_periodic()" freq="10."/>
  <makefile>
    <define name="MOBILE_CAM"/>
    <file name="cam_roll.c"/>
  </makefile>
</module>
