<!DOCTYPE module SYSTEM "module.dtd">

<module name="booz_cam" dir="cam_control">
  <!-- depend require="booz_pwm|led" -->
  <header>
    <file name="booz_cam.h"/>
  </header>
  <init fun="booz_cam_init()"/>
  <periodic fun="booz_cam_periodic()" freq="10."/>
  <makefile>
    <define name="USE_CAM"/>
    <file name="booz_cam.c"/>
  </makefile>
</module>

