<!DOCTYPE module SYSTEM "module.dtd">

<!--
     Baro ETS module (I2C)
     @define BARO_ETS_I2C_DEV i2c device (default i2c0)
     -->

<module name="baro_ets" dir="sensors">

  <header>
    <file name="baro_ets.h"/>
  </header>
  <init fun="baro_ets_init()"/>
  <periodic fun="baro_ets_read_periodic()" freq="10."/>
  <event fun="BaroEtsEvent()"/>

  <makefile>
    <file name="baro_ets.c"/>
  </makefile>

</module>
